{
  "$schema": "../schemas/token-contract.schema.json",
  "schemaVersion": 1,
  "package": "@casauran/tokens",
  "cssNamespace": "csn",
  "layers": ["primitive", "semantic", "component", "theme"],
  "tokenTypes": [
    "color",
    "dimension",
    "font-family",
    "font-size",
    "font-weight",
    "line-height",
    "shadow",
    "duration",
    "easing",
    "number",
    "z-index"
  ],
  "primitives": [
    {
      "name": "color.neutral.0",
      "type": "color",
      "value": "#ffffff",
      "cssVariable": "--csn-ref-color-neutral-0",
      "description": "Lightest neutral reference color."
    },
    {
      "name": "color.neutral.50",
      "type": "color",
      "value": "#f8fafc",
      "cssVariable": "--csn-ref-color-neutral-50",
      "description": "Very light neutral reference color."
    },
    {
      "name": "color.neutral.100",
      "type": "color",
      "value": "#f1f5f9",
      "cssVariable": "--csn-ref-color-neutral-100",
      "description": "Light neutral reference color."
    },
    {
      "name": "color.neutral.200",
      "type": "color",
      "value": "#e2e8f0",
      "cssVariable": "--csn-ref-color-neutral-200",
      "description": "Soft neutral reference color."
    },
    {
      "name": "color.neutral.300",
      "type": "color",
      "value": "#cbd5e1",
      "cssVariable": "--csn-ref-color-neutral-300",
      "description": "Mid-light neutral reference color."
    },
    {
      "name": "color.neutral.500",
      "type": "color",
      "value": "#64748b",
      "cssVariable": "--csn-ref-color-neutral-500",
      "description": "Mid neutral reference color."
    },
    {
      "name": "color.neutral.700",
      "type": "color",
      "value": "#334155",
      "cssVariable": "--csn-ref-color-neutral-700",
      "description": "Dark neutral reference color."
    },
    {
      "name": "color.neutral.900",
      "type": "color",
      "value": "#0f172a",
      "cssVariable": "--csn-ref-color-neutral-900",
      "description": "Very dark neutral reference color."
    },
    {
      "name": "color.neutral.1000",
      "type": "color",
      "value": "#000000",
      "cssVariable": "--csn-ref-color-neutral-1000",
      "description": "Darkest neutral reference color."
    },
    {
      "name": "color.brand.50",
      "type": "color",
      "value": "#eff6ff",
      "cssVariable": "--csn-ref-color-brand-50",
      "description": "Light brand reference color."
    },
    {
      "name": "color.brand.100",
      "type": "color",
      "value": "#dbeafe",
      "cssVariable": "--csn-ref-color-brand-100",
      "description": "Soft brand reference color."
    },
    {
      "name": "color.brand.500",
      "type": "color",
      "value": "#2563eb",
      "cssVariable": "--csn-ref-color-brand-500",
      "description": "Primary brand reference color."
    },
    {
      "name": "color.brand.600",
      "type": "color",
      "value": "#1d4ed8",
      "cssVariable": "--csn-ref-color-brand-600",
      "description": "Strong brand reference color."
    },
    {
      "name": "color.brand.700",
      "type": "color",
      "value": "#1e40af",
      "cssVariable": "--csn-ref-color-brand-700",
      "description": "Dark brand reference color."
    },
    {
      "name": "color.red.50",
      "type": "color",
      "value": "#fef2f2",
      "cssVariable": "--csn-ref-color-red-50",
      "description": "Light danger reference color."
    },
    {
      "name": "color.red.500",
      "type": "color",
      "value": "#dc2626",
      "cssVariable": "--csn-ref-color-red-500",
      "description": "Danger reference color."
    },
    {
      "name": "color.red.700",
      "type": "color",
      "value": "#b91c1c",
      "cssVariable": "--csn-ref-color-red-700",
      "description": "Strong danger reference color."
    },
    {
      "name": "color.green.50",
      "type": "color",
      "value": "#f0fdf4",
      "cssVariable": "--csn-ref-color-green-50",
      "description": "Light success reference color."
    },
    {
      "name": "color.green.500",
      "type": "color",
      "value": "#16a34a",
      "cssVariable": "--csn-ref-color-green-500",
      "description": "Success reference color."
    },
    {
      "name": "color.green.700",
      "type": "color",
      "value": "#15803d",
      "cssVariable": "--csn-ref-color-green-700",
      "description": "Strong success reference color."
    },
    {
      "name": "color.amber.50",
      "type": "color",
      "value": "#fffbeb",
      "cssVariable": "--csn-ref-color-amber-50",
      "description": "Light warning reference color."
    },
    {
      "name": "color.amber.500",
      "type": "color",
      "value": "#d97706",
      "cssVariable": "--csn-ref-color-amber-500",
      "description": "Warning reference color."
    },
    {
      "name": "color.amber.700",
      "type": "color",
      "value": "#b45309",
      "cssVariable": "--csn-ref-color-amber-700",
      "description": "Strong warning reference color."
    },
    {
      "name": "space.0",
      "type": "dimension",
      "value": "0",
      "cssVariable": "--csn-ref-space-0",
      "description": "Zero spacing reference."
    },
    {
      "name": "space.1",
      "type": "dimension",
      "value": "0.25rem",
      "cssVariable": "--csn-ref-space-1",
      "description": "Extra-small spacing reference."
    },
    {
      "name": "space.2",
      "type": "dimension",
      "value": "0.5rem",
      "cssVariable": "--csn-ref-space-2",
      "description": "Small spacing reference."
    },
    {
      "name": "space.3",
      "type": "dimension",
      "value": "0.75rem",
      "cssVariable": "--csn-ref-space-3",
      "description": "Compact spacing reference."
    },
    {
      "name": "space.4",
      "type": "dimension",
      "value": "1rem",
      "cssVariable": "--csn-ref-space-4",
      "description": "Base spacing reference."
    },
    {
      "name": "space.5",
      "type": "dimension",
      "value": "1.25rem",
      "cssVariable": "--csn-ref-space-5",
      "description": "Medium spacing reference."
    },
    {
      "name": "space.6",
      "type": "dimension",
      "value": "1.5rem",
      "cssVariable": "--csn-ref-space-6",
      "description": "Large spacing reference."
    },
    {
      "name": "space.8",
      "type": "dimension",
      "value": "2rem",
      "cssVariable": "--csn-ref-space-8",
      "description": "Extra-large spacing reference."
    },
    {
      "name": "space.10",
      "type": "dimension",
      "value": "2.5rem",
      "cssVariable": "--csn-ref-space-10",
      "description": "Section spacing reference."
    },
    {
      "name": "space.12",
      "type": "dimension",
      "value": "3rem",
      "cssVariable": "--csn-ref-space-12",
      "description": "Large section spacing reference."
    },
    {
      "name": "radius.none",
      "type": "dimension",
      "value": "0",
      "cssVariable": "--csn-ref-radius-none",
      "description": "Square corner reference."
    },
    {
      "name": "radius.sm",
      "type": "dimension",
      "value": "0.25rem",
      "cssVariable": "--csn-ref-radius-sm",
      "description": "Small corner radius reference."
    },
    {
      "name": "radius.md",
      "type": "dimension",
      "value": "0.5rem",
      "cssVariable": "--csn-ref-radius-md",
      "description": "Medium corner radius reference."
    },
    {
      "name": "radius.lg",
      "type": "dimension",
      "value": "0.75rem",
      "cssVariable": "--csn-ref-radius-lg",
      "description": "Large corner radius reference."
    },
    {
      "name": "radius.full",
      "type": "dimension",
      "value": "9999px",
      "cssVariable": "--csn-ref-radius-full",
      "description": "Pill and circular radius reference."
    },
    {
      "name": "border.width.0",
      "type": "dimension",
      "value": "0",
      "cssVariable": "--csn-ref-border-width-0",
      "description": "No-border width reference."
    },
    {
      "name": "border.width.1",
      "type": "dimension",
      "value": "1px",
      "cssVariable": "--csn-ref-border-width-1",
      "description": "Default border width reference."
    },
    {
      "name": "border.width.2",
      "type": "dimension",
      "value": "2px",
      "cssVariable": "--csn-ref-border-width-2",
      "description": "Strong border width reference."
    },
    {
      "name": "font.family.sans",
      "type": "font-family",
      "value": "ui-sans-serif, system-ui, sans-serif",
      "cssVariable": "--csn-ref-font-family-sans",
      "description": "System-oriented sans-serif font stack."
    },
    {
      "name": "font.family.mono",
      "type": "font-family",
      "value": "ui-monospace, SFMono-Regular, Consolas, monospace",
      "cssVariable": "--csn-ref-font-family-mono",
      "description": "System-oriented monospace font stack."
    },
    {
      "name": "font.size.xs",
      "type": "font-size",
      "value": "0.75rem",
      "cssVariable": "--csn-ref-font-size-xs",
      "description": "Extra-small text size reference."
    },
    {
      "name": "font.size.sm",
      "type": "font-size",
      "value": "0.875rem",
      "cssVariable": "--csn-ref-font-size-sm",
      "description": "Small text size reference."
    },
    {
      "name": "font.size.md",
      "type": "font-size",
      "value": "1rem",
      "cssVariable": "--csn-ref-font-size-md",
      "description": "Body text size reference."
    },
    {
      "name": "font.size.lg",
      "type": "font-size",
      "value": "1.125rem",
      "cssVariable": "--csn-ref-font-size-lg",
      "description": "Large text size reference."
    },
    {
      "name": "font.size.xl",
      "type": "font-size",
      "value": "1.25rem",
      "cssVariable": "--csn-ref-font-size-xl",
      "description": "Extra-large text size reference."
    },
    {
      "name": "font.size.2xl",
      "type": "font-size",
      "value": "1.5rem",
      "cssVariable": "--csn-ref-font-size-2xl",